{
 "task": "19-py-qualify-columns-core",
 "oracle": {
  "unmodified_fails": true,
  "solution_passes": true,
  "sabotage_fails": true
 },
 "sabotage": "present",
 "mutants": {
  "killed": 10,
  "total": 10
 },
 "stability_runs": 3,
 "miner": {
  "name": "ratchet-mint",
  "version": "0.1.0"
 },
 "minted": "2026-08-26",
 "source": "sqlglot@4303c3f sqlglot/optimizer/qualify_columns.py"
}
