{
 "task": "20-py-xml-elements",
 "oracle": {
  "unmodified_fails": true,
  "solution_passes": true,
  "sabotage_fails": true
 },
 "sabotage": "present",
 "mutants": {
  "killed": 9,
  "total": 9
 },
 "stability_runs": 3,
 "miner": {
  "name": "ratchet-mint",
  "version": "0.1.0"
 },
 "minted": "2026-08-26",
 "source": "dspy@2a67bcc dspy/adapters/xml_adapter.py"
}
